{
  "schemaVersion": "guidance-eval.scenario.v1",
  "deviceId": "dev-eval-teacher",
  "packId": "teacher-cbse-slice",
  "packVersion": "1.0.0",
  "seed": 42,
  "scenarioId": "teacher/advance-proportion-to-unitary",
  "title": "Advance simple proportion → unitary method",
  "description": "Strong simple_proportion mastery → advance to unitary_method.",
  "subjectId": "subj.eval.teacher.advance.proportion",
  "activeConceptId": "math.simple_proportion",
  "mode": "exploratory",
  "masterySeed": {
    "math.simple_proportion": {
      "conceptId": "math.simple_proportion",
      "alpha": {
        "dev-eval-teacher": 20
      },
      "beta": {
        "dev-eval-teacher": 1
      },
      "lastExercisedAt": "001700000000000:000000:dev-eval-teacher"
    },
    "math.ratios": {
      "conceptId": "math.ratios",
      "alpha": {
        "dev-eval-teacher": 20
      },
      "beta": {
        "dev-eval-teacher": 1
      },
      "lastExercisedAt": "001700000000000:000000:dev-eval-teacher"
    },
    "math.equivalent_ratios": {
      "conceptId": "math.equivalent_ratios",
      "alpha": {
        "dev-eval-teacher": 20
      },
      "beta": {
        "dev-eval-teacher": 1
      },
      "lastExercisedAt": "001700000000000:000000:dev-eval-teacher"
    },
    "math.fractions": {
      "conceptId": "math.fractions",
      "alpha": {
        "dev-eval-teacher": 20
      },
      "beta": {
        "dev-eval-teacher": 1
      },
      "lastExercisedAt": "001700000000000:000000:dev-eval-teacher"
    }
  },
  "frictionHistory": [],
  "turnFriction": {
    "conceptId": "math.simple_proportion",
    "hesitationMs": 120,
    "inputVelocity": 2.8,
    "revisionCount": 0,
    "assistanceRequested": false,
    "outcome": "correct",
    "capturedAt": "001700000000000:000004:dev-eval-teacher"
  },
  "expected": {
    "routeAction": "advance",
    "targetConceptId": "math.unitary_method",
    "mode": "exploratory",
    "rationaleKeywords": [
      "0.85",
      "advancing",
      "unitary"
    ]
  },
  "tags": [
    "advance"
  ]
}
