{
  "schemaVersion": "guidance-eval.scenario.v1",
  "deviceId": "dev-eval-teacher",
  "packId": "teacher-cbse-slice",
  "packVersion": "1.0.0",
  "seed": 42,
  "scenarioId": "teacher/remediate-weakest-equivalent",
  "title": "Remediate to weakest prereq only (equivalent_ratios)",
  "description": "simple_proportion spike; only equivalent_ratios below τ_r (ratios strong) → remediate to equivalent_ratios and stop.",
  "subjectId": "subj.eval.teacher.remediate.weakest",
  "activeConceptId": "math.simple_proportion",
  "mode": "guided",
  "masterySeed": {
    "math.simple_proportion": {
      "conceptId": "math.simple_proportion",
      "alpha": {
        "dev-eval-teacher": 5
      },
      "beta": {
        "dev-eval-teacher": 5
      },
      "lastExercisedAt": "001700000000000:000000:dev-eval-teacher"
    },
    "math.ratios": {
      "conceptId": "math.ratios",
      "alpha": {
        "dev-eval-teacher": 20
      },
      "beta": {
        "dev-eval-teacher": 1
      },
      "lastExercisedAt": "001700000000000:000000:dev-eval-teacher"
    },
    "math.equivalent_ratios": {
      "conceptId": "math.equivalent_ratios",
      "alpha": {
        "dev-eval-teacher": 1
      },
      "beta": {
        "dev-eval-teacher": 20
      },
      "lastExercisedAt": "001700000000000:000000:dev-eval-teacher"
    },
    "math.fractions": {
      "conceptId": "math.fractions",
      "alpha": {
        "dev-eval-teacher": 20
      },
      "beta": {
        "dev-eval-teacher": 1
      },
      "lastExercisedAt": "001700000000000:000000:dev-eval-teacher"
    }
  },
  "frictionHistory": [],
  "turnFriction": {
    "conceptId": "math.simple_proportion",
    "hesitationMs": 18000,
    "inputVelocity": 0.4,
    "revisionCount": 2,
    "assistanceRequested": true,
    "outcome": "incorrect",
    "capturedAt": "001700000000000:000007:dev-eval-teacher"
  },
  "expected": {
    "routeAction": "remediate",
    "targetConceptId": "math.equivalent_ratios",
    "mode": "prerequisite-remediation",
    "rationaleKeywords": [
      "SPIKE",
      "loop",
      "equivalent_ratios"
    ]
  },
  "tags": [
    "remediate",
    "hesitation-spike",
    "multi-weak-prereq"
  ]
}
