{
  "schemaVersion": "guidance-eval.scenario.v1",
  "deviceId": "dev-eval-teacher",
  "packId": "teacher-cbse-slice",
  "packVersion": "1.0.0",
  "seed": 42,
  "scenarioId": "teacher/advance-ratios-to-equivalent",
  "title": "Advance ratios → equivalent ratios",
  "description": "Consolidated ratios mastery → first successor equivalent_ratios.",
  "subjectId": "subj.eval.teacher.advance.ratios",
  "activeConceptId": "math.ratios",
  "mode": "exploratory",
  "masterySeed": {
    "math.ratios": {
      "conceptId": "math.ratios",
      "alpha": {
        "dev-eval-teacher": 20
      },
      "beta": {
        "dev-eval-teacher": 1
      },
      "lastExercisedAt": "001700000000000:000000:dev-eval-teacher"
    },
    "math.fractions": {
      "conceptId": "math.fractions",
      "alpha": {
        "dev-eval-teacher": 20
      },
      "beta": {
        "dev-eval-teacher": 1
      },
      "lastExercisedAt": "001700000000000:000000:dev-eval-teacher"
    }
  },
  "frictionHistory": [],
  "turnFriction": {
    "conceptId": "math.ratios",
    "hesitationMs": 150,
    "inputVelocity": 3,
    "revisionCount": 0,
    "assistanceRequested": false,
    "outcome": "correct",
    "capturedAt": "001700000000000:000003:dev-eval-teacher"
  },
  "expected": {
    "routeAction": "advance",
    "targetConceptId": "math.equivalent_ratios",
    "mode": "exploratory",
    "rationaleKeywords": [
      "0.85",
      "advancing",
      "equivalent_ratios"
    ]
  },
  "tags": [
    "advance"
  ]
}
